question,answer
What is homeostasis?,"Homeostasis is the ability of the human body to maintain a stable internal environment despite changes in external conditions, such as temperature, humidity, and light."
Where is the nucleus located within a cell?,"The nucleus is located in the center of the cell, surrounded by the cytoplasm."
What is the primary function of epithelial tissue?,"Epithelial tissue forms a protective barrier that lines the surfaces and cavities of the body, such as the skin, respiratory tract, and gastrointestinal tract."
What is the primary goal of this textbook?,"The primary goal of this textbook is to make the discipline engaging and relevant to students, so that they can draw from it a working knowledge that will enrich their future studies and support them in their careers."
Where does the body's homeostasis maintenance focus in Unit 1?,"The body's regions, important chemicals, and cells maintain homeostasis."
"What is the largest organ of the body, as explored in Unit 2?",The skin is the largest organ of the body.
What is the primary function of the lymphatic system?,"The primary function of the lymphatic system is to defend the body against infection and disease by draining excess fluids and proteins from tissues, and filtering out pathogens and other foreign substances."
Where is the pancreas located in the human body?,"The pancreas is located in the abdominal cavity, behind the stomach and in front of the spine."
What is the relationship between insulin and glucose levels in the blood?,"Insulin helps to regulate glucose levels in the blood by facilitating the uptake of glucose by cells, thereby lowering blood glucose levels."
